{
  "analysis": [
    {
      "body_hash": "sha256:630fd271349d330682bcddd9d3b6971a555bca1801f3fe94ecfc89775701d875",
      "diagnostics": [],
      "id": "sgfix.order_count",
      "scope": "object-dependencies",
      "state": "complete"
    },
    {
      "body_hash": "sha256:612e81e12e1eddcb1d1900d28f69a821f0231f86084705c559aa8bb4b122fcc0",
      "diagnostics": [],
      "id": "sgfix.order_totals",
      "scope": "column-dependencies-and-lineage",
      "state": "complete"
    },
    {
      "body_hash": "sha256:f5acdd4ac2750a975c0a8ce667f8820bd164a75079f8d9d2226cc094f7eec602",
      "diagnostics": [
        {
          "code": "SG_TEMPORAL_SELF_LINEAGE",
          "message": "sgfix.customers.name reads its previous value; self DerivesFrom edge omitted"
        }
      ],
      "id": "sgfix.orders.trg_orders_touch",
      "scope": "object-dependencies",
      "state": "partial"
    },
    {
      "body_hash": "sha256:eb48c5efdd2dd49021f5d1eb4388119216d71301d9b753e8bcf064b7dad5a945",
      "diagnostics": [
        {
          "code": "SG_COLUMN_UNRESOLVED",
          "location": {
            "column": 45,
            "end_column": 48,
            "end_line": 1,
            "line": 1
          },
          "message": "column 'cid' cannot be resolved in its SQL scope"
        },
        {
          "code": "SG_TEMPORAL_SELF_LINEAGE",
          "message": "sgfix.customers.name reads its previous value; self DerivesFrom edge omitted"
        }
      ],
      "id": "sgfix.touch_customer(int)",
      "scope": "object-dependencies",
      "state": "partial"
    }
  ],
  "edges": [
    {
      "from": "sgfix",
      "kind": "contains",
      "to": "sgfix.a"
    },
    {
      "from": "sgfix",
      "kind": "contains",
      "to": "sgfix.b"
    },
    {
      "from": "sgfix",
      "kind": "contains",
      "to": "sgfix.customers"
    },
    {
      "from": "sgfix",
      "kind": "contains",
      "to": "sgfix.loop_self"
    },
    {
      "from": "sgfix",
      "kind": "contains",
      "to": "sgfix.order_count"
    },
    {
      "from": "sgfix",
      "kind": "contains",
      "to": "sgfix.order_items"
    },
    {
      "from": "sgfix",
      "kind": "contains",
      "to": "sgfix.order_totals"
    },
    {
      "from": "sgfix",
      "kind": "contains",
      "to": "sgfix.orders"
    },
    {
      "from": "sgfix",
      "kind": "contains",
      "to": "sgfix.products"
    },
    {
      "from": "sgfix",
      "kind": "contains",
      "to": "sgfix.standalone"
    },
    {
      "from": "sgfix",
      "kind": "contains",
      "to": "sgfix.tickets"
    },
    {
      "from": "sgfix",
      "kind": "contains",
      "to": "sgfix.touch_customer(int)"
    },
    {
      "from": "sgfix.a",
      "kind": "contains",
      "to": "sgfix.a.PRIMARY"
    },
    {
      "from": "sgfix.a",
      "kind": "contains",
      "to": "sgfix.a.a_b_fk"
    },
    {
      "from": "sgfix.a",
      "kind": "contains",
      "to": "sgfix.a.a_b_fk@index"
    },
    {
      "from": "sgfix.a",
      "kind": "contains",
      "to": "sgfix.a.b_id"
    },
    {
      "from": "sgfix.a",
      "kind": "contains",
      "to": "sgfix.a.id"
    },
    {
      "evidence": [
        {
          "detail": "fk a_b_fk: sgfix.a(b_id) -> sgfix.b(id)",
          "layer": "catalog"
        }
      ],
      "from": "sgfix.a",
      "kind": "references",
      "to": "sgfix.b"
    },
    {
      "evidence": [
        {
          "detail": "fk a_b_fk: b_id -> id",
          "layer": "catalog"
        }
      ],
      "from": "sgfix.a.b_id",
      "kind": "references",
      "to": "sgfix.b.id"
    },
    {
      "evidence": [
        {
          "detail": "fk b_a_fk: sgfix.b(a_id) -> sgfix.a(id)",
          "layer": "catalog"
        }
      ],
      "from": "sgfix.b",
      "kind": "references",
      "to": "sgfix.a"
    },
    {
      "from": "sgfix.b",
      "kind": "contains",
      "to": "sgfix.b.PRIMARY"
    },
    {
      "from": "sgfix.b",
      "kind": "contains",
      "to": "sgfix.b.a_id"
    },
    {
      "from": "sgfix.b",
      "kind": "contains",
      "to": "sgfix.b.b_a_fk"
    },
    {
      "from": "sgfix.b",
      "kind": "contains",
      "to": "sgfix.b.b_a_fk@index"
    },
    {
      "from": "sgfix.b",
      "kind": "contains",
      "to": "sgfix.b.id"
    },
    {
      "evidence": [
        {
          "detail": "fk b_a_fk: a_id -> id",
          "layer": "catalog"
        }
      ],
      "from": "sgfix.b.a_id",
      "kind": "references",
      "to": "sgfix.a.id"
    },
    {
      "from": "sgfix.customers",
      "kind": "contains",
      "to": "sgfix.customers.PRIMARY"
    },
    {
      "from": "sgfix.customers",
      "kind": "contains",
      "to": "sgfix.customers.id"
    },
    {
      "from": "sgfix.customers",
      "kind": "contains",
      "to": "sgfix.customers.name"
    },
    {
      "evidence": [
        {
          "detail": "fk loop_self_ibfk_1: sgfix.loop_self(parent_id) -> sgfix.loop_self(id)",
          "layer": "catalog"
        }
      ],
      "from": "sgfix.loop_self",
      "kind": "references",
      "to": "sgfix.loop_self"
    },
    {
      "from": "sgfix.loop_self",
      "kind": "contains",
      "to": "sgfix.loop_self.PRIMARY"
    },
    {
      "from": "sgfix.loop_self",
      "kind": "contains",
      "to": "sgfix.loop_self.id"
    },
    {
      "from": "sgfix.loop_self",
      "kind": "contains",
      "to": "sgfix.loop_self.loop_self_ibfk_1"
    },
    {
      "from": "sgfix.loop_self",
      "kind": "contains",
      "to": "sgfix.loop_self.parent_id"
    },
    {
      "from": "sgfix.loop_self",
      "kind": "contains",
      "to": "sgfix.loop_self.parent_id@index"
    },
    {
      "evidence": [
        {
          "detail": "fk loop_self_ibfk_1: parent_id -> id",
          "layer": "catalog"
        }
      ],
      "from": "sgfix.loop_self.parent_id",
      "kind": "references",
      "to": "sgfix.loop_self.id"
    },
    {
      "evidence": [
        {
          "detail": "sgfix.order_count Reads sgfix.orders",
          "layer": "body-parse"
        }
      ],
      "from": "sgfix.order_count",
      "kind": "reads",
      "to": "sgfix.orders"
    },
    {
      "from": "sgfix.order_items",
      "kind": "contains",
      "to": "sgfix.order_items.PRIMARY"
    },
    {
      "from": "sgfix.order_items",
      "kind": "contains",
      "to": "sgfix.order_items.id"
    },
    {
      "from": "sgfix.order_items",
      "kind": "contains",
      "to": "sgfix.order_items.order_id"
    },
    {
      "from": "sgfix.order_items",
      "kind": "contains",
      "to": "sgfix.order_items.order_id@index"
    },
    {
      "from": "sgfix.order_items",
      "kind": "contains",
      "to": "sgfix.order_items.order_items_ibfk_1"
    },
    {
      "from": "sgfix.order_items",
      "kind": "contains",
      "to": "sgfix.order_items.order_items_ibfk_2"
    },
    {
      "from": "sgfix.order_items",
      "kind": "contains",
      "to": "sgfix.order_items.product_id"
    },
    {
      "from": "sgfix.order_items",
      "kind": "contains",
      "to": "sgfix.order_items.product_id@index"
    },
    {
      "evidence": [
        {
          "detail": "fk order_items_ibfk_1: sgfix.order_items(order_id) -> sgfix.orders(id)",
          "layer": "catalog"
        }
      ],
      "from": "sgfix.order_items",
      "kind": "references",
      "to": "sgfix.orders"
    },
    {
      "evidence": [
        {
          "detail": "fk order_items_ibfk_2: sgfix.order_items(product_id) -> sgfix.products(id)",
          "layer": "catalog"
        }
      ],
      "from": "sgfix.order_items",
      "kind": "references",
      "to": "sgfix.products"
    },
    {
      "evidence": [
        {
          "detail": "fk order_items_ibfk_1: order_id -> id",
          "layer": "catalog"
        }
      ],
      "from": "sgfix.order_items.order_id",
      "kind": "references",
      "to": "sgfix.orders.id"
    },
    {
      "evidence": [
        {
          "detail": "fk order_items_ibfk_2: product_id -> id",
          "layer": "catalog"
        }
      ],
      "from": "sgfix.order_items.product_id",
      "kind": "references",
      "to": "sgfix.products.id"
    },
    {
      "evidence": [
        {
          "detail": "view sgfix.order_totals reads sgfix.customers",
          "layer": "body-parse"
        }
      ],
      "from": "sgfix.order_totals",
      "kind": "reads",
      "to": "sgfix.customers"
    },
    {
      "evidence": [
        {
          "detail": "view sgfix.order_totals reads sgfix.customers.id",
          "layer": "body-parse"
        }
      ],
      "from": "sgfix.order_totals",
      "kind": "reads",
      "to": "sgfix.customers.id"
    },
    {
      "evidence": [
        {
          "detail": "view sgfix.order_totals reads sgfix.customers.name",
          "layer": "body-parse"
        }
      ],
      "from": "sgfix.order_totals",
      "kind": "reads",
      "to": "sgfix.customers.name"
    },
    {
      "from": "sgfix.order_totals",
      "kind": "contains",
      "to": "sgfix.order_totals.customer_name"
    },
    {
      "from": "sgfix.order_totals",
      "kind": "contains",
      "to": "sgfix.order_totals.order_id"
    },
    {
      "from": "sgfix.order_totals",
      "kind": "contains",
      "to": "sgfix.order_totals.total"
    },
    {
      "evidence": [
        {
          "detail": "view sgfix.order_totals reads sgfix.orders",
          "layer": "body-parse"
        }
      ],
      "from": "sgfix.order_totals",
      "kind": "reads",
      "to": "sgfix.orders"
    },
    {
      "evidence": [
        {
          "detail": "view sgfix.order_totals reads sgfix.orders.customer_id",
          "layer": "body-parse"
        }
      ],
      "from": "sgfix.order_totals",
      "kind": "reads",
      "to": "sgfix.orders.customer_id"
    },
    {
      "evidence": [
        {
          "detail": "view sgfix.order_totals reads sgfix.orders.id",
          "layer": "body-parse"
        }